{"contract_name":"operation_request","contract_version":1,"request_id":"request_alpha","operation":"proposal_approve","idempotency_key":"idem_alpha","payload_digest":"aaaaaaaaaaaaaaaaaaaaaaaaaaaaaaaaaaaaaaaaaaaaaaaaaaaaaaaaaaaaaaaa","expected_revision":"revision_12","expected_workflow_version":3,"subject_id":"proposal_alpha","intent_digest":"bbbbbbbbbbbbbbbbbbbbbbbbbbbbbbbbbbbbbbbbbbbbbbbbbbbbbbbbbbbbbbbb","prior_receipt":{"idempotency_key":"idem_alpha","payload_digest":"aaaaaaaaaaaaaaaaaaaaaaaaaaaaaaaaaaaaaaaaaaaaaaaaaaaaaaaaaaaaaaaa","same_payload_digest":true,"outcome":"exact_replay"}}
